### ISSUE TITLE
CloudSim is counting multicast packets sent from fc2 to fc1 in the up/downlink quotes

### ISSUE THREAD

**Issue by osrf-migration** [osrf/cloudsim-legacy#131]
**Original report ([archived issue](https://osrf-migration.github.io/osrf-archived-gh-pages/#!/osrf/cloudsim-legacy/issues/131)) by Maurice Fallon (Bitbucket: [mauricefallon](https://bitbucket.org/%7B8bca6a99-adab-444a-b7f0-81660c79adfb%7D/)).**

----------------------------------------
CloudSim is counting comms sent fc1 and fc2 in the up/downlink quotes. It should not.

I'd imagine you have tested this for ROS-based transmission, but our team uses UDP Multicast to pass data between fc1 and fc2 (specifcall the  LCM package).

When I transmit data from fc2 to fc1 its counted in my downlink volume.
For the bandwidth regimes mentioned in the document, when I re-transmit camera imagery internally, it uses up my bandwidth in about 5 seconds - despite none of the traffic leaving the SoftLayer site.

I don't notice the problem when transmitting from fc1 to fc2.

**Comment by osrf-migration** [comment]
**Original comment by Brian Gerkey (Bitbucket: [Brian Gerkey](https://bitbucket.org/%7B3d8b5763-9dad-4be7-85c2-a7ab6cd49173%7D/), GitHub: [gerkey](https://github.com/gerkey)).**

----------------------------------------

* changed title from "CloudSim is counting comms sent from fc2 to fc2 in the up/downlink quotes" to "CloudSim is counting comms sent from fc1 to fc2 in the up/downlink quotes"

**Comment by osrf-migration** [comment]
**Original comment by Brian Gerkey (Bitbucket: [Brian Gerkey](https://bitbucket.org/%7B3d8b5763-9dad-4be7-85c2-a7ab6cd49173%7D/), GitHub: [gerkey](https://github.com/gerkey)).**

----------------------------------------
The count is determined by a [filter expression](https://github.com/osrf/cloudsim-client-tools/blob/19a7b30cc27acf5c0c55dd047d7af6c24087c04f/vrc_bytecounter/src/byteCounter.c#L305), which is basically checking for a packet that is:

1. from or to {sim, fc1, fc2} AND
2. NOT from or to router

(There's other stuff in there to not count NTP and DNS queries coming from the sim machine.)

It makes sense that if you're sending multicast packets between fc1 and fc2, the router will overhear them and they'll be caught by that filter.  As you've guessed, we tested with ROS comms, which is unicast, and didn't put in support for multicast.

This should be easy to fix.  Digging into pcap-filter....

**Comment by osrf-migration** [comment]
**Original comment by Brian Gerkey (Bitbucket: [Brian Gerkey](https://bitbucket.org/%7B3d8b5763-9dad-4be7-85c2-a7ab6cd49173%7D/), GitHub: [gerkey](https://github.com/gerkey)).**

----------------------------------------

* changed title from "CloudSim is counting comms sent from fc1 to fc2 in the up/downlink quotes" to "CloudSim is counting multicast packets sent from fc1 to fc2 in the up/downlink quotes"

**Comment by osrf-migration** [comment]
**Original comment by Brian Gerkey (Bitbucket: [Brian Gerkey](https://bitbucket.org/%7B3d8b5763-9dad-4be7-85c2-a7ab6cd49173%7D/), GitHub: [gerkey](https://github.com/gerkey)).**

----------------------------------------
Debugging filter expression in an environment where multicast is in use between fc1 and fc2:

Original expression (not including the NTP/DNS sim exclusion):
~~~
$ sudo tcpdump -i bond0 "(ip host (10.0.0.51 or 10.0.0.52 or 10.0.0.53) and not 10.0.0.50)"                     
tcpdump: verbose output suppressed, use -v or -vv for full protocol decode
listening on bond0, link-type EN10MB (Ethernet), capture size 65535 bytes
10:21:01.923783 IP 10.0.0.53.53743 > 239.255.76.67.7667: UDP, length 1420
10:21:01.923808 IP 10.0.0.53.53743 > 239.255.76.67.7667: UDP, length 1038
10:21:01.955823 IP 10.0.0.52.34324 > 239.255.76.67.7667: UDP, length 1420
10:21:01.955844 IP 10.0.0.52.34324 > 239.255.76.67.7667: UDP, length 1028
~~~

Add `and not ip multicast`:
~~~
$ sudo tcpdump -i bond0 "(ip host (10.0.0.51 or 10.0.0.52 or 10.0.0.53) and not 10.0.0.50) and not ip multicast"
tcpdump: verbose output suppressed, use -v or -vv for full protocol decode
listening on bond0, link-type EN10MB (Ethernet), capture size 65535 bytes
10:21:39.861898 IP 10.0.0.53.ntp > mighty.poclabs.net.ntp: NTPv4, Client, length 48
10:21:39.889722 IP mighty.poclabs.net.ntp > 10.0.0.53.ntp: NTPv4, Server, length 48
10:21:40.841784 IP 10.0.0.52.9000 > 11.8.0.2.9001: UDP, length 8
10:21:42.974399 IP 10.0.0.52.9000 > 11.8.0.2.9001: UDP, length 8
~~~

**Comment by osrf-migration** [comment]
**Original comment by Brian Gerkey (Bitbucket: [Brian Gerkey](https://bitbucket.org/%7B3d8b5763-9dad-4be7-85c2-a7ab6cd49173%7D/), GitHub: [gerkey](https://github.com/gerkey)).**

----------------------------------------
Checking the full expression:

~~~
$ sudo tcpdump -i bond0 "(ip host (10.0.0.51 or 10.0.0.52 or 10.0.0.53) and not 10.0.0.50) and not ip multicast"
tcpdump: verbose output suppressed, use -v or -vv for full protocol decode
listening on bond0, link-type EN10MB (Ethernet), capture size 65535 bytes
10:21:39.861898 IP 10.0.0.53.ntp > mighty.poclabs.net.ntp: NTPv4, Client, length 48
10:21:39.889722 IP mighty.poclabs.net.ntp > 10.0.0.53.ntp: NTPv4, Server, length 48
10:21:40.841784 IP 10.0.0.52.9000 > 11.8.0.2.9001: UDP, length 8
10:21:42.974399 IP 10.0.0.52.9000 > 11.8.0.2.9001: UDP, length 8
~~~

**Comment by osrf-migration** [comment]
**Original comment by Brian Gerkey (Bitbucket: [Brian Gerkey](https://bitbucket.org/%7B3d8b5763-9dad-4be7-85c2-a7ab6cd49173%7D/), GitHub: [gerkey](https://github.com/gerkey)).**

----------------------------------------

* changed state from "new" to "resolved"

Believe that it's fixed by [cloudsim-client-tools pull request #16](https://osrf-migration.github.io/osrf-archived-gh-pages/#!/osrf/cloudsim-client-tools/pull-request/16).  Reopen if that's not the case.

**Comment by osrf-migration** [comment]
**Original comment by Maurice Fallon (Bitbucket: [mauricefallon](https://bitbucket.org/%7B8bca6a99-adab-444a-b7f0-81660c79adfb%7D/)).**

----------------------------------------
Brian, your change to the issue title is incorrect - the router was counting fc2 to fc1 last night. (obviously neither should be counted)

**Comment by osrf-migration** [comment]
**Original comment by Brian Gerkey (Bitbucket: [Brian Gerkey](https://bitbucket.org/%7B3d8b5763-9dad-4be7-85c2-a7ab6cd49173%7D/), GitHub: [gerkey](https://github.com/gerkey)).**

----------------------------------------

* changed title from "CloudSim is counting multicast packets sent from fc1 to fc2 in the up/downlink quotes" to "CloudSim is counting multicast packets sent from fc2 to fc1 in the up/downlink quotes"

**Comment by osrf-migration** [comment]
**Original comment by Brian Gerkey (Bitbucket: [Brian Gerkey](https://bitbucket.org/%7B3d8b5763-9dad-4be7-85c2-a7ab6cd49173%7D/), GitHub: [gerkey](https://github.com/gerkey)).**

----------------------------------------
@faller , thanks for the tip on the title; fixed.  The original title incorrectly read "fc2 to fc2", and I apparently chose the wrong one to change.
